{
  "schema_version": "sloth.report/v1.0",
  "tool_version": "example",
  "rule_version": "1.0.0",
  "tool": {"commit": "example", "build_time": "example", "dirty": false},
  "run": {
    "id": "example-samples",
    "created_at": "2026-10-27T12:00:00Z",
    "started_at": "2026-10-27T12:00:00Z",
    "finished_at": "2026-10-27T12:00:01Z",
    "interrupted": false
  },
  "target": {
    "scheme": "https",
    "host": "example.com",
    "path": "/api",
    "query_keys": ["token"],
    "redacted_url": "https://example.com/api?token=%5BREDACTED%5D",
    "fingerprint": "aaaaaaaaaaaaaaaaaaaaaaaaaaaaaaaaaaaaaaaaaaaaaaaaaaaaaaaaaaaaaaaa"
  },
  "configuration": {
    "method": "GET",
    "timeout_ms": 30000,
    "requests": 1,
    "warmups": 0,
    "rate_per_second": 5,
    "concurrency_stages": [1],
    "follow_redirects": false,
    "redirect_limit": 5,
    "color": "auto",
    "body_limit_bytes": 1048576,
    "include_samples": true,
    "sample_limit": 1,
    "allow_high_load": false,
    "allow_unsafe_methods": false
  },
  "environment": {"os": "example", "arch": "example", "go_version": "example", "cpus": 1},
  "overall": {
    "measured_outcomes": {
      "attempted": 1,
      "completed": 1,
      "successful": 1,
      "http_error": 0,
      "transport_error": 0,
      "timeout": 0,
      "cancelled": 0,
      "body_limit": 0
    },
    "warmup_attempts": 0,
    "warmup_outcomes": {},
    "response_bytes": 100,
    "interrupted_experiments": 0
  },
  "experiments": [{
    "id": "baseline",
    "kind": "baseline",
    "requested_samples": 1,
    "warmup_requests": 0,
    "workers": 1,
    "rate_per_second": 5,
    "warmup_outcomes": {},
    "execution": {
      "started_at": "2026-10-27T12:00:00Z",
      "finished_at": "2026-10-27T12:00:01Z",
      "offered_starts": 1,
      "achieved_starts": 1,
      "missed_arrivals": 0,
      "interrupted": false
    },
    "aggregate": {
      "outcomes": {
        "attempted": 1,
        "completed": 1,
        "successful": 1,
        "http_error": 0,
        "transport_error": 0,
        "timeout": 0,
        "cancelled": 0,
        "body_limit": 0
      },
      "status_classes": {"2xx": 1},
      "response_bytes": 100,
      "latency": {"count": 1, "min_ms": 10, "max_ms": 10, "mean_ms": 10, "p50_ms": 10, "p90_ms": 10, "p95_ms": 10, "p99_ms": 10, "population_stddev_ms": 0},
      "scheduling_delay": {"count": 1, "min_ms": 0, "max_ms": 0, "mean_ms": 0, "p50_ms": 0, "p90_ms": 0, "p95_ms": 0, "p99_ms": 0, "population_stddev_ms": 0},
      "phases": {},
      "rates": {"duration_ms": 1000, "offered_starts": 1, "achieved_starts": 1, "offered_per_second": 1, "achieved_per_second": 1, "completed_per_second": 1},
      "concurrency": {"peak": 1, "time_weighted_in_flight": 0.01},
      "protocols": {"HTTP/1.1": 1},
      "connections": {"observed": 1, "new": 0, "reused": 1},
      "interrupted": false
    },
    "limitations": []
  }],
  "diagnostics": [],
  "limitations": [],
  "sample_export": {"available": 1, "included": 1, "limit": 1, "truncated": false},
  "samples": [{
    "experiment_id": "baseline",
    "sequence": 0,
    "planned_start": "2026-10-27T12:00:00Z",
    "actual_start": "2026-10-27T12:00:00Z",
    "finished_at": "2026-10-27T12:00:00.01Z",
    "scheduling_delay_ms": 0,
    "timings": {
      "total": {"duration_ms": 10},
      "dns": {"duration_ms": null, "unavailable_reason": "connection_reused"},
      "connect": {"duration_ms": null, "unavailable_reason": "connection_reused"},
      "tls": {"duration_ms": null, "unavailable_reason": "connection_reused"},
      "request_write": {"duration_ms": 1},
      "first_byte_wait": {"duration_ms": 8},
      "body_transfer": {"duration_ms": 1}
    },
    "outcome": {"category": "success", "response_received": true, "complete": true},
    "connection": {"observed": true, "reused": true, "was_idle": false},
    "protocol": "HTTP/1.1",
    "status_code": 200,
    "response_bytes": 100
  }]
}
